Uri Identifier,Label,Notation,Parent Uri Identifier,Sort Priority,Description
5u0,ADC (Andean Development Corporation),5U0,,0,
7h0,AFREXIMBANK (African Export-Import Bank),7H0,,1,
5m0,AMF (Arab Monetary Fund),5M0,,2,
4j8420,ATHENA Mechanism,4J8420,,3,
5d0,AfDB (African Development Bank),5D0,,4,
5z10,Africa Finance Corporation,5Z10,,5,
5z20,African Development Bank Group,5Z20,,6,
5q0,African Development Fund,5Q0,,7,
6a10,African Union,6A10,,8,
4j810,Agency for the Cooperation of Energy Regulators,4J810,,9,
4a0,All the European Union Institutions excluding the ECB and ESM  deprecated,4A0,,10,
4y0,All the European Union Institutions including the ECB and ESM deprecated,4Y0,,11,
li1,Amt fur Volkswirtschaft,LI1,,12,
ad2,Andorra Finance institute,AD2,,13,
5z30,Arab Fund for Economic and Social Development,5Z30,,14,
5e0,AsDB (Asian Development Bank),5E0,,15,
5z40,Asian Clearing Union,5Z40,,16,
5r0,Asian Development Fund,5R0,,17,
6a20,Association of Southeast Asian Nations,6A20,,18,
au1,Australian Bureau of Statistics,AU1,,19,
no98,Avinor (Civil Aviation Administration),NO98,,20,
5n0,BADEA (Banque arabe pour le développement économique en Afrique),5N0,,21,
de6,BAFIN (Bundesanstalt fuer Finanzdienstleistungsaufsicht),DE6,,22,
5o0,BCEAO (Banque Centrale des États de l’Afrique de l’Ouest),5O0,,23,
5w0,BEAC (Banque des Etats de l`Afrique Centrale),5W0,,24,
5b0,BIS (Bank for International Settlements),5B0,,25,
7i0,BLADEX (Banco Latino Americano De Comercio Exterior),7I0,,26,
id1,BPS-Statistics Indonesia,ID1,,27,
bh2,Bahrain Monetary Authority,BH2,,28,
it2,Banca d’Italia (Italy),IT2,,29,
bo2,Banco Central de Bolivia,BO2,,30,
cl2,Banco Central de Chile,CL2,,31,
cr2,Banco Central de Costa Rica,CR2,,32,
cu2,Banco Central de Cuba,CU2,,33,
hn2,Banco Central de Honduras,HN2,,34,
ni2,Banco Central de Nicaragua,NI2,,35,
sv2,Banco Central de Reserva de El Salvador,SV2,,36,
pe2,Banco Central de Reserva del Perú,PE2,,37,
st2,Banco Central de Sao Tome e Principe,ST2,,38,
tl2,Banco Central de Timor-Leste,TL2,,39,
ve2,Banco Central de Venezuela,VE2,,40,
ar2,Banco Central de la Republica Argentina,AR2,,41,
do2,Banco Central de la República Dominicana,DO2,,42,
ec2,Banco Central del Ecuador,EC2,,43,
py2,Banco Central del Paraguay,PY2,,44,
uy2,Banco Central del Uruguay,UY2,,45,
br2,Banco Central do Brasil,BR2,,46,
ao2,Banco Nacional de Angola,AO2,,47,
pa2,Banco Nacional de Panama,PA2,,48,
cv2,Banco de Cabo Verde (Cape Verde),CV2,,49,
es2,Banco de Espana (Spain),ES2,,50,
gt2,Banco de Guatemala,GT2,,51,
mx2,Banco de Mexico,MX2,,52,
mz2,Banco de Moçambique,MZ2,,53,
pt2,Banco de Portugal (Portugal),PT2,,54,
co2,Banco de la República (Colombia),CO2,,55,
bd2,Bangladesh Bank,BD2,,56,
bd1,Bangladesh Bureau of Statistics,BD1,,57,
ma2,Bank Al-Maghrib (Morocco),MA2,,58,
id2,Bank Indonesia,ID2,,59,
my2,Bank Negara Malaysia,MY2,,60,
al2,Bank of Albania,AL2,,61,
bw2,Bank of Botswana,BW2,,62,
ca2,Bank of Canada,CA2,,63,
gb2,Bank of England (United Kingdom),GB2,,64,
er2,Bank of Eritrea,ER2,,65,
ee2,Bank of Estonia,EE2,,66,
fi2,Bank of Finland (Finland),FI2,,67,
gh2,Bank of Ghana,GH2,,68,
gr2,Bank of Greece (Greece),GR2,,69,
gy2,Bank of Guyana,GY2,,70,
il2,Bank of Israel,IL2,,71,
jm2,Bank of Jamaica,JM2,,72,
jp2,Bank of Japan,JP2,,73,
ki2,"Bank of Kiribati, Ltd",KI2,,74,
lv2,Bank of Latvia,LV2,,75,
lt2,Bank of Lithuania,LT2,,76,
mu2,Bank of Mauritius,MU2,,77,
mn2,Bank of Mongolia,MN2,,78,
na2,Bank of Namibia,NA2,,79,
pg2,Bank of Papua New Guinea,PG2,,80,
sl2,Bank of Sierra Leone,SL2,,81,
si2,Bank of Slovenia,SI2,,82,
ss2,Bank of South Sudan,SS2,,83,
sd2,Bank of Sudan,SD2,,84,
tz2,Bank of Tanzania,TZ2,,85,
th2,Bank of Thailand,TH2,,86,
ug2,Bank of Uganda,UG2,,87,
zm2,Bank of Zambia,ZM2,,88,
la2,Bank of the Lao P.D.R.,LA2,,89,
an2,Bank of the Netherlands Antilles,AN2,,90,
mg2,Banque Centrale de Madagascar,MG2,,91,
mr2,Banque Centrale de Mauritanie,MR2,,92,
gn2,Banque Centrale de la Republique de Guinee,GN2,,93,
km2,Banque Centrale des Comoros,KM2,,94,
sn2,Banque Centrale des États de l'Afrique de l'Ouest (BCEAO) (Senegal),SN2,,95,
tg2,Banque Centrale des États de l'Afrique de l'Ouest (BCEAO) (Togo),TG2,,96,
bj2,Banque Centrale des États de l’Afrique de l’Ouest (BCEAO) (Benin),BJ2,,97,
bf2,Banque Centrale des États de l’Afrique de l’Ouest (BCEAO) (Burkina Faso),BF2,,98,
ci2,Banque Centrale des États de l’Afrique de l’Ouest (BCEAO) (Côte d'Ivoire),CI2,,99,
gw2,Banque Centrale des États de l’Afrique de l’Ouest (BCEAO) (Guinea-Bissau),GW2,,100,
ml2,Banque Centrale des États de l’Afrique de l’Ouest (BCEAO) (Mali),ML2,,101,
ne2,Banque Centrale des États de l’Afrique de l’Ouest (BCEAO) (Niger),NE2,,102,
cd2,"Banque Centrale du Congo (Congo, Dem. Rep. of)",CD2,,103,
rw2,Banque Nationale Du Rwanda,RW2,,104,
be2,Banque Nationale de Belgique (Belgium),BE2,,105,
dj2,Banque Nationale de Djibouti,DJ2,,106,
tn2,Banque centrale de Tunisie,TN2,,107,
fr2,Banque de France (France),FR2,,108,
ht2,Banque de la Republique d'Haiti,HT2,,109,
bi2,Banque de la Republique du Burundi,BI2,,110,
cm2,Banque des États de l’Afrique Centrale (BEAC) (Cameroon),CM2,,111,
cf2,Banque des États de l’Afrique Centrale (BEAC) (Central African Republic),CF2,,112,
td2,Banque des États de l’Afrique Centrale (BEAC) (Chad),TD2,,113,
cg2,"Banque des États de l’Afrique Centrale (BEAC) (Congo, Rep. of)",CG2,,114,
gq2,Banque des États de l’Afrique Centrale (BEAC) (Equatorial Guinea),GQ2,,115,
ga2,Banque des États de l’Afrique Centrale (BEAC) (Gabon),GA2,,116,
lb2,Banque du Liban (Lebanon),LB2,,117,
dz2,Banque d’Algérie,DZ2,,118,
bb1,Barbados Statistical Service,BB1,,119,
bm1,Bermuda Government - Department of Statistics,BM1,,120,
bm2,Bermuda Monetary Authority,BM2,,121,
7g0,Black Sea Trade and Development Banks,7G0,,122,
us3,Board of Governors of the Federal Reserve System (USA),US3,,123,
4j820,Body of European Regulators for Electronic Communications,4J820,,124,
ba4,Bosnia and Herzegovina Ministry of Finance and Treasury,BA4,,125,
br1,Brazilian Institute of Statistics and Geography (IBGE) (Brazil),BR1,,126,
bn2,Brunei Currency and Monetary Board (BCMB),BN2,,127,
bg2,Bulgarian National Bank,BG2,,128,
de4,Bundesministerium der Finanzen (Germany),DE4,,129,
sx1,Bureau for Statistics Sint Maarten,SX1,,130,
us7,Bureau of Census,US7,,131,
us8,Bureau of Economic Analysis,US8,,132,
us6,Bureau of Labor Statistics,US6,,133,
fj1,Bureau of Statistics (Fiji),FJ1,,134,
jp1,Bureau of Statistics (Japan),JP1,,135,
ls1,Bureau of Statistics (Lesotho),LS1,,136,
ph3,Bureau of the Treasury (Philippines),PH3,,137,
be9,Bureau van Dijk (Belgium),BE9,,138,
gb98,CAA (Civil Aviation Authority),GB98,,139,
5t0,CABEI (Central American Bank for Economic Integration),5T0,,140,
5p0,CASDB (Central African States Development Bank),5P0,,141,
5l0,CDB (Caribbean Development Bank),5L0,,142,
7e0,CEB (Council of Europe Development Bank),7E0,,143,
5x0,CEMAC (Communauté Économique et Monétaire de l’Afrique Centrale),5X0,,144,
6p0,CERN (European Organisation for Nuclear Research),6P0,,145,
lu6,CSSF (Luxembourg Financial Sector Surveillance Commission),LU6,,146,
6a30,Caribbean Community and Common Market,6A30,,147,
ky2,Cayman Islands Monetary Authority,KY2,,148,
hk1,"Census and Statistics Department (China, P.R.: Hong Kong)",HK1,,149,
ly1,Census and Statistics Directorate (Libya),LY1,,150,
lb1,Central Administration of Statistics (Lebanon),LB1,,151,
eg1,Central Agency for Public Mobilization and Stats. (Egypt),EG1,,152,
6a40,Central American Common Market,6A40,,153,
am2,Central Bank of Armenia,AM2,,154,
bb2,Central Bank of Barbados,BB2,,155,
bz2,Central Bank of Belize,BZ2,,156,
ba2,Central Bank of Bosnia and Herzegovina,BA2,,157,
cw2,Central Bank of Curacao and Sint Maarten,CW2,,158,
cy2,Central Bank of Cyprus,CY2,,159,
eg2,Central Bank of Egypt,EG2,,160,
is2,Central Bank of Iceland,IS2,,161,
iq2,Central Bank of Iraq,IQ2,,162,
ie2,Central Bank of Ireland (Ireland),IE2,,163,
jo2,Central Bank of Jordan,JO2,,164,
ke2,Central Bank of Kenya,KE2,,165,
kw2,Central Bank of Kuwait,KW2,,166,
ls2,Central Bank of Lesotho,LS2,,167,
lr2,Central Bank of Liberia,LR2,,168,
ly2,Central Bank of Libya,LY2,,169,
lu2,Central Bank of Luxembourg,LU2,,170,
mt2,Central Bank of Malta,MT2,,171,
me2,Central Bank of Montenegro,ME2,,172,
mm2,Central Bank of Myanmar,MM2,,173,
ng2,Central Bank of Nigeria,NG2,,174,
om2,Central Bank of Oman,OM2,,175,
ru2,Central Bank of Russian Federation,RU2,,176,
ws2,Central Bank of Samoa,WS2,,177,
sc2,Central Bank of Seychelles,SC2,,178,
sb2,Central Bank of Solomon Islands,SB2,,179,
so2,Central Bank of Somalia,SO2,,180,
lk2,Central Bank of Sri Lanka,LK2,,181,
sz2,Central Bank of Swaziland,SZ2,,182,
sy2,Central Bank of Syria,SY2,,183,
tt2,Central Bank of Trinidad and Tobago,TT2,,184,
tm2,Central Bank of Turkmenistan,TM2,,185,
ye2,Central Bank of Yemen,YE2,,186,
gm2,Central Bank of the Gambia,GM2,,187,
ph2,Central Bank of the Philippines,PH2,,188,
tw2,Central Bank of the Republic of China (Taiwan),TW2,,189,
xk2,Central Bank of the Republic of Kosovo,XK2,,190,
tr2,Central Bank of the Republic of Turkey,TR2,,191,
ae2,Central Bank of the United Arab Emirates,AE2,,192,
aw1,Central Bureau of Statistics (Aruba),AW1,,193,
hr1,Central Bureau of Statistics (Croatia),HR1,,194,
cw1,Central Bureau of Statistics (Curacao),CW1,,195,
il1,Central Bureau of Statistics (Israel),IL1,,196,
ke1,Central Bureau of Statistics (Kenya),KE1,,197,
na1,Central Bureau of Statistics (Namibia),NA1,,198,
np1,Central Bureau of Statistics (Nepal),NP1,,199,
an1,Central Bureau of Statistics (Netherlands Antilles),AN1,,200,
sd1,Central Bureau of Statistics (Sudan),SD1,,201,
sy1,Central Bureau of Statistics (Syria Arab Rep.),SY1,,202,
nl1,Central Bureau voor de Statistiek (Netherlands),NL1,,203,
sa1,Central Department of Statistics (Saudi Arabia),SA1,,204,
lv1,Central Statistical Bureau of Latvia,LV1,,205,
ai1,Central Statistical Office (Anguilla),AI1,,206,
bz1,Central Statistical Office (Belize),BZ1,,207,
bt1,Central Statistical Office (Bhutan),BT1,,208,
dm1,Central Statistical Office (Dominica),DM1,,209,
ie1,Central Statistical Office (Ireland),IE1,,210,
mu1,Central Statistical Office (Mauritius),MU1,,211,
sz1,Central Statistical Office (Swaziland),SZ1,,212,
tt1,Central Statistical Office (Trinidad and Tobago),TT1,,213,
zm1,Central Statistical Office (Zambia),ZM1,,214,
zw1,Central Statistical Office (Zimbabwe),ZW1,,215,
pl1,Central Statistical Office of Poland,PL1,,216,
mm1,Central Statistical Organization (Myanmar),MM1,,217,
ye1,Central Statistical Organization (Yemen),YE1,,218,
ae1,"Central Statistical Organization, part of the Ministry of Economy and Planning (United Arab Emirates)",AE1,,219,
za1,Central Statistical Service (South Africa),ZA1,,220,
gm1,Central Statistics Division (Gambia),GM1,,221,
bw1,Central Statistics Office (Botswana),BW1,,222,
c992,"Central banks of the new EU Member States 2004 (CY,CZ,EE,HU,LV,LT,MT,PL,SK,SI",C992,,223,
aw2,Centrale Bank van Aruba,AW2,,224,
sr2,Centrale Bank van Suriname,SR2,,225,
cg1,"Centre National de la Statistique et des Edudes Economiques (CNSEE)   (Congo, Rep of)",CG1,,226,
is98,Civil Aviation Administration,IS98,,227,
gr98,Civil Aviation Authority,GR98,,228,
5z50,Colombo Plan,5Z50,,229,
4j70,Committee of Regions,4J70,,230,
4j830,Community Plant Variety Office,4J830,,231,
4j840,Computer Emergency Response Team,4J840,,232,
ck4,Cook Islands Ministry of Finance,CK4,,233,
ck1,Cook Islands Statistics Office,CK1,,234,
6c0,Council of Europe,6C0,,235,
4j20,Council of the European Union,4J20,,236,
4j40,Court of Auditors,4J40,,237,
4j30,Court of Justice,4J30,,238,
hr2,Croatian National Bank,HR2,,239,
qa3,Customs Department (Qatar),QA3,,240,
et3,Customs and Excise Administration (Ethiopia),ET3,,241,
cz2,Czech National Bank,CZ2,,242,
cz1,Czech Statistical Office,CZ1,,243,
fr98,DGAC(Direction General de l`Aviation Civil),FR98,,244,
fr97,DTMPL France,FR97,,245,
af2,Da Afghanistan Bank,AF2,,246,
dk98,Danish Civil Aviation Administration,DK98,,247,
dk2,Danmarks Nationalbank (Denmark),DK2,,248,
dk1,Danmarks Statistik (Denmark),DK1,,249,
co1,Departamento Administrativo Nacional  de Estadísticas (Colombia),CO1,,250,
es3,Departamento de Aduanas (Spain),ES3,,251,
mo4,"Departamento de Estudos e Planeamento Financeiro (China,P.R.:Macao)",MO4,,252,
bw3,Department of Customs and Excise (Botswana),BW3,,253,
za3,Department of Customs and Excise (South Africa),ZA3,,254,
bn3,Department of Economic Planning and Development (DEPD) (Brunei Darussalam),BN3,,255,
gb3,"Department of Environment, Transport and the Regions (United Kingdom)",GB3,,256,
ky1,Department of Finance & Development / Statistical Office (Cayman Islands),KY1,,257,
ie4,Department of Finance (Ireland),IE4,,258,
bs1,Department of Statistics (Bahamas),BS1,,259,
bn1,Department of Statistics (Brunei Darussalam),BN1,,260,
jo1,Department of Statistics (Jordan),JO1,,261,
mq1,Department of Statistics (Martinique),MQ1,,262,
ws1,Department of Statistics (Samoa),WS1,,263,
my1,Department of Statistics Malaysia,MY1,,264,
mr1,Department of Statistics and Economic Studies (Mauritania),MR1,,265,
cy1,Department of Statistics and Research (Ministry of Finance) (Cyprus),CY1,,266,
gb4,Department of Trade and Industry (United Kingdom),GB4,,267,
au5,Department of the Treasury (Australia),AU5,,268,
de2,Deutsche Bundesbank (Germany),DE2,,269,
7n0,Development Bank of Latin America (Banco de Desarrollo de America Latina),7N0,,270,
pt3,Direccao Geral do Orçamento (DGO) (Portugal),PT3,,271,
hn1,Direccion General de Censos y Estadisticas (Honduras),HN1,,272,
dj1,Direction Nationale de la Statistique (National Department of Statistics) (Djibouti),DJ1,,273,
ml1,Direction Nationale de la Statistique et de  l’Informatique (DNSI) (Mali),ML1,,274,
sn1,Direction de la Prevision et de la Statistique (Senegal),SN1,,275,
fr5,Direction generale des douanes (France),FR5,,276,
ch3,Direction genérale des douanes (Switzerland),CH3,,277,
bh1,Directorate of Statistics (Bahrain),BH1,,278,
pa1,Directorate of Statistics and Census (Panama),PA1,,279,
mz1,Direcção Nacional de Estatística (Mozambique),MZ1,,280,
ae_du6,Dubai Financial Services Authority,AE_DU6,,281,
4t10,EBA (European Banking Authority),4T10,,282,
5f0,EBRD (European Bank for Reconstruction and Development),5F0,,283,
6k0,EBU/UER (European Broadcasting Union/Union européenne de radio-télévision),6K0,,284,
4f0,ECB (European Central Bank),4F0,,285,
5i0,ECCB (Eastern Caribbean Central Bank),5I0,,286,
5y0,ECCU (Eastern Caribbean Currency Union),5Y0,,287,
6n0,ECMWF (European Centre for Medium-Range Weather Forecasts),6N0,,288,
6a60,ECOWAS Bank for Investment and Development,6A60,,289,
7c0,EDB (Eurasian Development Bank ),7C0,,290,
4e0,EDF (European Development Fund),4E0,,291,
4w0,EFSF (European Financial Stability Facility),4W0,,292,
4c0,EIB (European Investment Bank),4C0,,293,
4g0,EIF (European Investment Fund),4G0,,294,
4t30,EIOPA (European Insurance and Occupational Pensions Authority),4T30,,295,
6i0,EMBL (European Molecular Biology Laboratory),6I0,,296,
6f0,EPO (European Patent Office),6F0,,297,
6e0,ESA (European Space Agency),6E0,,298,
4s0,ESM (European Stability Mechanism),4S0,,299,
4t20,ESMA (European Securities and Markets Authority),4T20,,300,
6m0,ESO (European Southern Observatory),6M0,,301,
b22,EU 15 central banks,B22,,302,
b32,EU 25 central banks,B32,,303,
b42,EU 27 central banks,B42,,304,
b52,EU 28 central banks,B52,,305,
u32,EU central banks not belonging to the Euro area,U32,,306,
b62,EU27 central banks (fixed composition) as of 31 January 2020 (brexit),B62,,307,
6l0,EUMETSAT (European Organisation for the Exploitation of Meteorological Satellites),6L0,,308,
4u20,EURATOM Supply Agency,4U20,,309,
6g0,EUROCONTROL (European Organisation for the Safety of Air Navigation),6G0,,310,
7m0,EUROFIMA (European Company for the Financing of Railroad Rolling Stock),7M0,,311,
6h0,EUTELSAT (European Telecommunications Satellite Organisation),6H0,,312,
6a50,East African Development Bank,6A50,,313,
ag2,Eastern Caribbean Central Bank (ECCB) (Antigua and Barbuda),AG2,,314,
dm2,Eastern Caribbean Central Bank (ECCB) (Dominica),DM2,,315,
gd2,Eastern Caribbean Central Bank (ECCB) (Grenada),GD2,,316,
kn2,Eastern Caribbean Central Bank (ECCB) (St. Kitts and Nevis),KN2,,317,
lc2,Eastern Caribbean Central Bank (ECCB) (St. Lucia),LC2,,318,
vc2,Eastern Caribbean Central Bank (ECCB) (St. Vincent and Grenadines),VC2,,319,
5z60,Economic Community of West African States,5Z60,,320,
kr3,"Economic Planning Board (Korea, Republic of)",KR3,,321,
4j60,Economic and Social Committee,4J60,,322,
ee1,"Estonia, State Statistical Office",EE1,,323,
i22,Euro area 12 central banks,I22,,324,
i32,Euro area 13 central banks,I32,,325,
i42,Euro area 15 central banks,I42,,326,
i52,Euro area 16 central banks,I52,,327,
i62,Euro area 17 central banks,I62,,328,
i72,Euro area 18 central banks,I72,,329,
i82,Euro area 19 central banks,I82,,330,
u22,Euro area central banks,U22,,331,
4j850,European Agency for Safety and Health at Work,4J850,,332,
4j860,European Agency for the Management of Operational Cooperation at the External Borders,4J860,,333,
4j870,"European Agency for the operational management of large-scale IT systems in the area of freedom, security and justice",4J870,,334,
4j880,European Asylum Support Office,4J880,,335,
4j890,European Aviation Safety Agency,4J890,,336,
4j8100,European Centre for Disease Prevention and Control,4J8100,,337,
4j8110,European Centre for the Development of Vocational Training,4J8110,,338,
4j8120,European Chemicals Agency,4J8120,,339,
4d0,European Commission (including Eurostat),4D0,,340,
4h0,European Community of Steel and Coal deprecated,4H0,,341,
4j50,European Council,4J50,,342,
4j8130,European Data Protection Supervisor,4J8130,,343,
4j8140,European Defence Agency,4J8140,,344,
4j8150,European Environment Agency,4J8150,,345,
4j8160,European External Action Service,4J8160,,346,
4j8170,European Fisheries Control Agency,4J8170,,347,
4j8180,European Food Safety Authority,4J8180,,348,
4j8190,European Foundation for the Improvement of Living and Working Conditions,4J8190,,349,
5z70,European Free Trade Association,5Z70,,350,
4j8200,European GNSS Agency,4J8200,,351,
4j8210,European Institute for Gender Equality,4J8210,,352,
4j8220,European Institute of Innovation and Technology,4J8220,,353,
4j8230,European Maritime Safety Agency,4J8230,,354,
4j8240,European Medicines Agency,4J8240,,355,
4j8250,European Monitoring Centre for Drugs and Drug Addiction,4J8250,,356,
4j8260,European Network and Information Security Agency,4J8260,,357,
4j8270,European Ombudsman,4J8270,,358,
4j10,European Parliament,4J10,,359,
4j8280,European Personnel Selection Office,4J8280,,360,
4j8290,European Police College,4J8290,,361,
4j8300,European Police Office,4J8300,,362,
4j8310,European Public Prosecutor's Office,4J8310,,363,
4j8320,European Railway Agency,4J8320,,364,
4j8330,European School of Administration,4J8330,,365,
4j8340,European Training Foundation,4J8340,,366,
4j8350,European Union Agency for Fundamental Rights,4J8350,,367,
4j8360,European Union Institute for Security Studies,4J8360,,368,
4j8370,European Union Intellectual Property Office,4J8370,,369,
4j8380,European Union Satellite Centre,4J8380,,370,
1j0,FAO (Food and Agriculture Organisation),1J0,,371,
lv6,FCMC (Latvia Financial and Capital Market Commission),LV6,,372,
7j0,FLAR (Fondo Latino Americano de Reservas),7J0,,373,
at6,FMA (Austria Financial Market Authority),AT6,,374,
ng4,Federal Ministry of Finance (Nigeria),NG4,,375,
cs4,Federal Ministry of Finance (Serbia and Montenegro),CS4,,376,
ng1,Federal Office of Statistics (Nigeria),NG1,,377,
be40,Federal Planning Bureau,BE40,,378,
be3,Federal Public Service Finance (Belgium),BE3,,379,
us2,Federal Reserve Bank of New York (USA),US2,,380,
ru1,Federal State Statistics Service (Russian Federation),RU1,,381,
fm2,"Federal States of Micronesia Banking Board (Micronesia, Federated States of)",FM2,,382,
cs1,Federal Statistical Office (Serbia and Montenegro),CS1,,383,
jp6,Financial Services Agency (Japan),JP6,,384,
gg6,"Financial Services Commission, Guernsey (GG)",GG6,,385,
je6,"Financial Services Commission, Jersey (JE)",JE6,,386,
hk4,"Financial Services and the Treasury Bureau (Treasury) (China, P.R.: Hong Kong)",HK4,,387,
im6,"Financial Supervision Commission, Isle of Man (IM)",IM6,,388,
fi98,Finavia(Civil Aviation Administration),FI98,,389,
fi97,Finnish Maritime Administration,FI97,,390,
7k0,Fonds Belgo-Congolais d'Amortissement et de Gestion,7K0,,391,
5s0,Fonds spécial unifié de développement,5S0,,392,
4u10,Fusion for Energy,4U10,,393,
5z80,Fusion for Energy deprecated,5Z80,,394,
cn5,"General Administration of Customs (China, P.R.: Mainland)",CN5,,395,
sr1,General Bureau of Statistics (Suriname),SR1,,396,
ly4,General Directorate for Economic and Social Planning (Libya),LY4,,397,
rw1,General Office of Statistics (Rwanda),RW1,,398,
ly3,General People's Secretariat  of the Treasury (Libya),LY3,,399,
vn1,General Statistics Office (Vietnam),VN1,,400,
gh1,Ghana Statistical Service,GH1,,401,
uz1,Goskomprognozstat (Uzbekistan),UZ1,,402,
gu1,Guam Bureau of Statistics,GU1,,403,
tr3,Hazine Müstesarligi (Turkish Treasury),TR3,,404,
va2,Holy See (Vatican City State) National Central Bank,VA2,,405,
hk2,Hong Kong Monetary Authority,HK2,,406,
hu1,Hungarian Central Statistical Office,HU1,,407,
5c0,IADB (Inter-American Development Bank),5C0,,408,
1r0,IAEA (International Atomic Energy Agency),1R0,,409,
5j0,IBEC (International Bank for Economic Co-operation),5J0,,410,
6d0,ICRC (International Committee of the Red Cross),6D0,,411,
1g0,ICSID (International Centre for Settlement of Investment Disputes),1G0,,412,
7b0,IDB (Islamic Development Bank),7B0,,413,
1l0,IFAD (International Fund for Agricultural Development),1L0,,414,
1m0,IFC (International Finance Corporation),1M0,,415,
7l0,IFFIm (International finance Facility for Immunisation),7L0,,416,
de8,IFO Institut für Wirtschaftsforschung (Germany),DE8,,417,
5k0,IIB (International Investment Bank),5K0,,418,
5g0,IIC (Inter-American Investment Corporation),5G0,,419,
1s0,ILO (International Labour Organisation),1S0,,420,
1c0,IMF (International Monetary Fund),1C0,,421,
mg1,INSTAT/Exchanges Commerciaux et des Services (Madagascar),MG1,,422,
6j0,INTELSAT (International Telecommunications Satellite Organisation),6J0,,423,
6q0,IOM (International Organisation for Migration),6Q0,,424,
1t0,ITU (International Telecommunication Union),1T0,,425,
ht1,Institut Haitien de Statistique et d' Informatique (Haiti),HT1,,426,
be1,Institut National de Statistiques de Belgique,BE1,,427,
bj1,Institut National de la Statistique et de l’Analyse Economique (Benin),BJ1,,428,
fr1,Institut National de la Statistique et des Etudes Economiques - INSEE (France),FR1,,429,
gf1,"Institut National de la Statistique et des Etudes Economiques - INSEE - Service regional (Guiana, French)",GF1,,430,
gp1,Institut National de la Statistique et des Etudes Economiques - INSEE -Service regional (Guadeloupe),GP1,,431,
nc1,Institut Territorial de la Statistique et des Etudes Economiques (New Caledonia),NC1,,432,
td1,Institut de la Statistique (INSDEE) (Chad),TD1,,433,
cd1,"Institute National de la Statistique (Congo, Dem. Rep. of)",CD1,,434,
al1,Institute of Statistics (Albania),AL1,,435,
ba1,Institute of Statistics (Bosnia and Herzegovina),BA1,,436,
bo1,Instituto Nacional de Estadistica (Bolivia),BO1,,437,
gt1,Instituto Nacional de Estadistica (Guatemala),GT1,,438,
ar1,Instituto Nacional de Estadistica y Censos (Argentina),AR1,,439,
ec1,Instituto Nacional de Estadistica y Censos (Ecuador),EC1,,440,
es1,Instituto Nacional de Estadística (Spain),ES1,,441,
mx1,Instituto Nacional de Estadística Geografia e Informatica (INEGI) (Mexico),MX1,,442,
cv1,Instituto Nacional de Estatistica (Cape Verde),CV1,,443,
pt1,Instituto Nacional de Estatística (Portugal),PT1,,444,
sm2,Instituto di Credito Sammarinese / Central Bank (San Marino),SM2,,445,
5z90,Intergovernmental Council of Copper Exporting Countries,5Z90,,446,
1e0,International Bank for Reconstruction and Development,1E0,,447,
6z20,International Centre for Migration Policy Development,6Z20,,448,
5z100,International Civil Aviation Organization,5Z100,,449,
5z110,International Cocoa Organization,5Z110,,450,
5z120,International Coffee Organization,5Z120,,451,
5z130,International Copper Study Group,5Z130,,452,
5z140,International Cotton Advisory Committee,5Z140,,453,
1f0,International Development Association,1F0,,454,
sg3,International Enterprise Singapore,SG3,,455,
5z150,International Grains Council,5Z150,,456,
5z160,International Jute Study Group,5Z160,,457,
5z170,International Lead and Zinc Study Group,5Z170,,458,
5z180,International Maritime Organization,5Z180,,459,
5z190,International Maritime Satellite Organization,5Z190,,460,
5z200,International Olive Oil Council,5Z200,,461,
9a0,International Organisations excl. European Community Institutions (4Y),9A0,,462,
5z210,International Rubber Study Group,5Z210,,463,
5z220,International Sugar Organization,5Z220,,464,
7f0,International Union of Credit and Investment Insurers,7F0,,465,
1a0,International organisations,1A0,,466,
it1,Istituto Nazionale di Statistica (ISTAT) (Italy),IT1,,467,
it9,Istituto di Studi e Analisi Economica (Italy),IT9,,468,
4t0,Joint Committee of the European Supervisory Authorities (ESAs),4T0,,469,
kr1,Korea National Statistical Office (KNSO),KR1,,470,
xk1,Kosovo agency of Statistics,XK1,,471,
de3,Kraftfahrt-Bundesamt (Germany),DE3,,472,
6a70,Latin American Association of Development Financing Institutions,6A70,,473,
5z240,Latin American Energy Organization,5Z240,,474,
5z250,Latin American Integration Association,5Z250,,475,
5z230,Latin American and the Caribbean Economic System,5Z230,,476,
5z260,League of Arab States,5Z260,,477,
lt1,"Lithuania, Department of Statistics",LT1,,478,
mt6,MFSA (Malta Financial Services Authority),MT6,,479,
1n0,MIGA (Multilateral Investment Guarantee Agency),1N0,,480,
