Uri Identifier,Label,Notation,Parent Uri Identifier,Sort Priority,Description
se1,Statistics Sweden (Sweden),SE1,,929,
mo1,"Statistics and Census Department (China,P.R.:Macao)",MO1,,930,
kw1,Statistics and Information Technology Sector (Kuwait),KW1,,931,
at1,Statistik Österreich (Austria),AT1,,932,
de1,Statistisches Bundesamt (Germany),DE1,,933,
pa6,Superintendencia de Bancos (Panama),PA6,,934,
se2,Sveriges Riksbank (Sweden),SE2,,935,
ch4,Swiss Federal Finance Administration (Switzerland),CH4,,936,
ch1,Swiss Federal Statistical Office,CH1,,937,
ch2,Swiss National Bank,CH2,,938,
kr2,The Bank of Korea,KR2,,939,
bs2,The Central Bank of the Bahamas,BS2,,940,
ir2,The Central Bank of the Islamic Republic of Iran,IR2,,941,
7o0,The Eastern and Southern African Trade and Development Bank,7O0,,942,
4j8400,The European Union’s Judicial Cooperation Unit,4J8400,,943,
6z10,"The Global Fund to Fight AIDS, Tuberculosis and Malaria",6Z10,,944,
kr6,The Korea Financial Services Commission,KR6,,945,
ly5,The National Corporation for Information and Documentation (Libya),LY5,,946,
us4_1,The Office of Financial Research (OFR),US4_1,,947,
ie3,The Office of the Revenue Commissioners (Ireland),IE3,,948,
cn2,The People's Bank of China,CN2,,949,
lv3,The Treasury of the Republic of Latvia,LV3,,950,
1y0,The United Nations World Food Programme,1Y0,,951,
4j8410,Translation Centre for the Bodies of the European Union,4J8410,,952,
dj3,Trésor National (Djibouti),DJ3,,953,
ga5,Trésorier-Payeur Général  du Gabon,GA5,,954,
tv1,Tuvalu Statistics,TV1,,955,
us5,U.S. Department of Commerce (USA),US5,,956,
us4,U.S. Department of Treasury (USA),US4,,957,
1b0,UN organisations,1B0,,958,
1h0,"UNESCO (United Nations Educational, Scientific and Cultural Organisation)",1H0,,959,
1p0,UNHCR (United Nations High Commissioner for Refugees),1P0,,960,
1o0,UNICEF (United Nations Children Fund),1O0,,961,
1q0,UNRWA (United Nations Relief and Works Agency for Palestine),1Q0,,962,
it3,Ufficio Italiano dei Cambi (Italy),IT3,,963,
ug1,Uganda Bureau of Statistics,UG1,,964,
5z340,United Nations Conference on Trade and Development,5Z340,,965,
1x0,United Nations Office on Drugs and Crimes(UNODC),1X0,,966,
1v0,Universal Postal Union,1V0,,967,
zzz,"Unspecified (e.g. any, dissemination, internal exchange etc)",ZZZ,,968,
7a0,WAEMU (West African Economic and Monetary Union),7A0,,969,
1k0,WHO (World Health Organisation),1K0,,970,
5z350,West African Economic Community,5Z350,,971,
5z360,West African Health Organisation,5Z360,,972,
5z370,West African Monetary Agency,5Z370,,973,
5z380,West African Monetary Institute,5Z380,,974,
5z390,World Council of Churches,5Z390,,975,
5z400,World Intellectual Property Organization,5Z400,,976,
5z410,World Meteorological Organization,5Z410,,977,
5z420,World Tourism Organization,5Z420,,978,
1d0,World Trade Organisation,1D0,,979,
de9,"Zentrum fur Europaische Wirtschaftsforschnung (ZEW, Germany)",DE9,,980,
